BEGIN;
CREATE TABLE time_test AS SELECT '2014-01-01 12:00:00'::aj_time, 1 as num;
SELECT * FROM time_test;
       aj_time       | num 
---------------------+-----
 2014-01-01 12:00:00 |   1
(1 row)

UPDATE time_test SET num = 2;
SELECT * FROM time_test;
       aj_time       | num 
---------------------+-----
 2014-01-01 12:00:00 |   2
(1 row)

ROLLBACK;
BEGIN;
CREATE TABLE date_test AS SELECT '2014-01-01'::aj_date, 1 as num;
SELECT * FROM date_test;
  aj_date   | num 
------------+-----
 2014-01-01 |   1
(1 row)

UPDATE date_test SET num = 2;
SELECT * FROM date_test;
  aj_date   | num 
------------+-----
 2014-01-01 |   2
(1 row)

ROLLBACK;
BEGIN;
CREATE TABLE country_test AS SELECT 'de'::country, 1 as num;
SELECT * FROM country_test;
 country | num 
---------+-----
 de      |   1
(1 row)

UPDATE country_test SET num = 2;
SELECT * FROM country_test;
 country | num 
---------+-----
 de      |   2
(1 row)

ROLLBACK;
BEGIN;
CREATE TABLE os_name_test AS SELECT 'ios'::os_name, 1 as num;
SELECT * FROM os_name_test;
 os_name | num 
---------+-----
 ios     |   1
(1 row)

UPDATE os_name_test SET num = 2;
SELECT * FROM os_name_test;
 os_name | num 
---------+-----
 ios     |   2
(1 row)

ROLLBACK;
BEGIN;
CREATE TABLE device_type_test AS SELECT 'phone'::device_type, 1 as num;
SELECT * FROM device_type_test;
 device_type | num 
-------------+-----
 phone       |   1
(1 row)

UPDATE device_type_test SET num = 2;
SELECT * FROM device_type_test;
 device_type | num 
-------------+-----
 phone       |   2
(1 row)

ROLLBACK;
